<?xml version="1.0"?>
<!DOCTYPE Recetario SYSTEM "../dtd/recetario.dtd">
<Recetario>
    <nombre>Recetario1</nombre>
    <recetas>
        <recetas dificultad="Dificil">
            <nombre>Lasanna</nombre>
            <ingrediente>
                <ingrediente>Tomate</ingrediente>
                <ingrediente>Carne</ingrediente>
                <ingrediente>Pasta</ingrediente>
                <ingrediente>Queso</ingrediente>
                <ingrediente>Aceite</ingrediente>
                <ingrediente>Sal</ingrediente>
                <ingrediente>Bechamel</ingrediente>
            </ingrediente>
            <precio>12.0</precio>
        </recetas>
        <recetas dificultad="Facil">
            <nombre>Sandwich de pavo</nombre>
            <ingrediente>
                <ingrediente>Pavo</ingrediente>
                <ingrediente>Pan</ingrediente>
            </ingrediente>
            <precio>1.5</precio>
        </recetas>
        <recetas dificultad="Facil">
            <nombre>Filete de ternera</nombre>
            <ingrediente>
                <ingrediente>Carne de ternera</ingrediente>
                <ingrediente>Aceite</ingrediente>
                <ingrediente>Sal</ingrediente>
            </ingrediente>
            <precio>1.0</precio>
        </recetas>
    </recetas>
    <precio>20.0</precio>
</Recetario>
